<?xml version="1.0" encoding="utf-8"?>
<?xml-stylesheet type="text/xsl" href="libros.xsl"?>
<?xml-stylesheet href="libros.css"?>
<libros xmlns:xsi="http://www.w3.org/2001/XMLSchema-instance" xsi:noNamespaceSchemaLocation="file:///C:/Users/carol/Desktop/fullXML/libros.xsd">
	<libro>
		<titulo>Everyday Italian</titulo>
		<año>• Año: 2005</año>
		<precio moneda="€">• 39.99</precio>
	</libro>
	<libro>
		<titulo>Harry Potter</titulo>
		<año>• Año: 2005</año>
		<precio moneda= "€">• 29.99</precio>
	</libro>
	<libro>
		<titulo>XQuery Kick Start</titulo>
		<año>• Año: 2003</año>
		<precio moneda= "€">• 49.99</precio>
	</libro>
	<libro>
		<titulo lang="en">Learning XML</titulo>
		<año>• Año: 2003</año>
		<precio>• 39.95</precio>
	</libro>
</libros>